{
  "$schema": "../../shared/schemas/source-snapshot.schema.json",
  "source": "crossandean_morphology",
  "upstream": "https://zenodo.org/records/5498292",
  "license": "CC-BY-4.0",
  "licenseUrl": null,
  "citation": "CLDF dataset on Quechua morphology derived from Blum et al.'s \"Una aproximación filolingüística a la clasificación interna del Quechua\" from 2021 — Frederic Blum; Carlos B. Ugarte; Adriano Ingunza; Zoe Poirier",
  "pin": {
    "kind": "doi",
    "value": "v1.0",
    "doi": "10.5281/zenodo.5498292",
    "date": "2021-09-09"
  },
  "files": [
    {
      "path": ".transcription-report.json",
      "bytes": 95797,
      "sha256": "925ffe86f337495fd397575ab6091b04df943e4cfa8ae8abb338de2daa8dee44",
      "url": "https://zenodo.org/api/records/5498292/files/cldf-datasets/crossandean_morphology-v1.0.zip/content",
      "upstreamChecksum": null,
      "upstreamVerified": false,
      "derivedFrom": "cldf-datasets/crossandean_morphology-v1.0.zip:cldf-datasets-crossandean_morphology-86bc750/cldf/.transcription-report.json"
    },
    {
      "path": "cldf-metadata.json",
      "bytes": 13173,
      "sha256": "bd1ee8518dcd8001dd18c8cf4839b4c379baea2e8add0d69df75063845b79f3b",
      "url": "https://zenodo.org/api/records/5498292/files/cldf-datasets/crossandean_morphology-v1.0.zip/content",
      "upstreamChecksum": null,
      "upstreamVerified": false,
      "derivedFrom": "cldf-datasets/crossandean_morphology-v1.0.zip:cldf-datasets-crossandean_morphology-86bc750/cldf/cldf-metadata.json"
    },
    {
      "path": "cognates.csv",
      "bytes": 218887,
      "sha256": "ebd425c1e196125a180670ee30714e5df1a09ce06940dd73a791831c94814dd2",
      "url": "https://zenodo.org/api/records/5498292/files/cldf-datasets/crossandean_morphology-v1.0.zip/content",
      "upstreamChecksum": null,
      "upstreamVerified": false,
      "derivedFrom": "cldf-datasets/crossandean_morphology-v1.0.zip:cldf-datasets-crossandean_morphology-86bc750/cldf/cognates.csv"
    },
    {
      "path": "forms.csv",
      "bytes": 198315,
      "sha256": "2212d1d138506af2a4335d2333f9b6d0aded39b0368c54c1af027aeb17f98464",
      "url": "https://zenodo.org/api/records/5498292/files/cldf-datasets/crossandean_morphology-v1.0.zip/content",
      "upstreamChecksum": null,
      "upstreamVerified": false,
      "derivedFrom": "cldf-datasets/crossandean_morphology-v1.0.zip:cldf-datasets-crossandean_morphology-86bc750/cldf/forms.csv"
    },
    {
      "path": "languages.csv",
      "bytes": 2480,
      "sha256": "4de3132862931f10fbf08c7e79bb08988a93bfb8fe0ba1f484bff3f99647897c",
      "url": "https://zenodo.org/api/records/5498292/files/cldf-datasets/crossandean_morphology-v1.0.zip/content",
      "upstreamChecksum": null,
      "upstreamVerified": false,
      "derivedFrom": "cldf-datasets/crossandean_morphology-v1.0.zip:cldf-datasets-crossandean_morphology-86bc750/cldf/languages.csv"
    },
    {
      "path": "lingpy-rcParams.json",
      "bytes": 7637,
      "sha256": "48441f5cef9694573897c9361f12f4e7aa5c9498032ee52fe4e3c43a82a94f86",
      "url": "https://zenodo.org/api/records/5498292/files/cldf-datasets/crossandean_morphology-v1.0.zip/content",
      "upstreamChecksum": null,
      "upstreamVerified": false,
      "derivedFrom": "cldf-datasets/crossandean_morphology-v1.0.zip:cldf-datasets-crossandean_morphology-86bc750/cldf/lingpy-rcParams.json"
    },
    {
      "path": "parameters.csv",
      "bytes": 6006,
      "sha256": "967b85d6e10049ea2daa892ee97ed5f0e0f48e1fa3f9d10ab076941a777b82b5",
      "url": "https://zenodo.org/api/records/5498292/files/cldf-datasets/crossandean_morphology-v1.0.zip/content",
      "upstreamChecksum": null,
      "upstreamVerified": false,
      "derivedFrom": "cldf-datasets/crossandean_morphology-v1.0.zip:cldf-datasets-crossandean_morphology-86bc750/cldf/parameters.csv"
    },
    {
      "path": "requirements.txt",
      "bytes": 832,
      "sha256": "faebe42580fd510d465a97eda17f5ad73b314a8d5c4de463b71266e1520f4463",
      "url": "https://zenodo.org/api/records/5498292/files/cldf-datasets/crossandean_morphology-v1.0.zip/content",
      "upstreamChecksum": null,
      "upstreamVerified": false,
      "derivedFrom": "cldf-datasets/crossandean_morphology-v1.0.zip:cldf-datasets-crossandean_morphology-86bc750/cldf/requirements.txt"
    },
    {
      "path": "sources.bib",
      "bytes": 5365,
      "sha256": "8149b57c7322c40a1a38a8d64a989ee96ccce560ba61eac8b2cedc0ed24054a2",
      "url": "https://zenodo.org/api/records/5498292/files/cldf-datasets/crossandean_morphology-v1.0.zip/content",
      "upstreamChecksum": null,
      "upstreamVerified": false,
      "derivedFrom": "cldf-datasets/crossandean_morphology-v1.0.zip:cldf-datasets-crossandean_morphology-86bc750/cldf/sources.bib"
    }
  ],
  "verified": true,
  "fetchedBy": "cli/scripts/fetchers/cldf-zenodo.mjs",
  "notes": "Extracted from cldf-datasets/crossandean_morphology-v1.0.zip, whose md5 matched Zenodo's published checksum (md5:659700a3c00f33e40b776629a681b1f9). The per-file sha256 values below are ours, computed on extraction — their provenance is the verified archive named in `derivedFrom`, not an independent attestation by the publisher.",
  "fetchedAt": "2026-08-18T20:32:38.566Z"
}
