{
  "$schema": "../../shared/schemas/source-snapshot.schema.json",
  "source": "abvdphilippines",
  "upstream": "https://zenodo.org/records/13304336",
  "license": "CC-BY-4.0",
  "licenseUrl": null,
  "citation": "CLDF dataset derived from Greenhill et al.'s \"Austronesian Basic Vocabulary Database\" from 2020 focusing on Philippine languages — Simon J. Greenhill; Robert Blust; Russell D. Gray; Benedict King; Lawrence A. Reid; Malcolm Ross; Mary Walworth",
  "pin": {
    "kind": "doi",
    "value": "v1.0",
    "doi": "10.5281/zenodo.13304336",
    "date": "2024-08-12"
  },
  "files": [
    {
      "path": "Wordlist-metadata.json",
      "bytes": 13864,
      "sha256": "297f5f9f210c0085c02a70aad466c39abebd1372b2c2c03dfad6502e78cf2ed9",
      "url": "https://zenodo.org/api/records/13304336/files/lexibank/abvdphilippines-v1.0.zip/content",
      "upstreamChecksum": null,
      "upstreamVerified": false,
      "derivedFrom": "lexibank/abvdphilippines-v1.0.zip:lexibank-abvdphilippines-10010f6/cldf/Wordlist-metadata.json"
    },
    {
      "path": "cldf-metadata.json",
      "bytes": 13864,
      "sha256": "297f5f9f210c0085c02a70aad466c39abebd1372b2c2c03dfad6502e78cf2ed9",
      "url": "https://zenodo.org/api/records/13304336/files/lexibank/abvdphilippines-v1.0.zip/content",
      "upstreamChecksum": null,
      "upstreamVerified": false,
      "derivedFrom": "lexibank/abvdphilippines-v1.0.zip:lexibank-abvdphilippines-10010f6/cldf/cldf-metadata.json"
    },
    {
      "path": "cognates.csv",
      "bytes": 3787198,
      "sha256": "55ed73b9bf50bbb660ff252cb15b401d0083136cec1e6363411b9aabc758ac67",
      "url": "https://zenodo.org/api/records/13304336/files/lexibank/abvdphilippines-v1.0.zip/content",
      "upstreamChecksum": null,
      "upstreamVerified": false,
      "derivedFrom": "lexibank/abvdphilippines-v1.0.zip:lexibank-abvdphilippines-10010f6/cldf/cognates.csv"
    },
    {
      "path": "forms.csv",
      "bytes": 4951846,
      "sha256": "0113453251e043a9435e5fe69b159a738e4b764c9e7e40637181008263f9f474",
      "url": "https://zenodo.org/api/records/13304336/files/lexibank/abvdphilippines-v1.0.zip/content",
      "upstreamChecksum": null,
      "upstreamVerified": false,
      "derivedFrom": "lexibank/abvdphilippines-v1.0.zip:lexibank-abvdphilippines-10010f6/cldf/forms.csv"
    },
    {
      "path": "languages.csv",
      "bytes": 70306,
      "sha256": "009369e3c1d9e70df128291a6b0209d86031d5e5d97d5b35ed73f31cd9d8d874",
      "url": "https://zenodo.org/api/records/13304336/files/lexibank/abvdphilippines-v1.0.zip/content",
      "upstreamChecksum": null,
      "upstreamVerified": false,
      "derivedFrom": "lexibank/abvdphilippines-v1.0.zip:lexibank-abvdphilippines-10010f6/cldf/languages.csv"
    },
    {
      "path": "lingpy-rcParams.json",
      "bytes": 7637,
      "sha256": "c39bf5f474cef751d3be65b9634fc7671f56fd4cf33544872ef9585fae85bce3",
      "url": "https://zenodo.org/api/records/13304336/files/lexibank/abvdphilippines-v1.0.zip/content",
      "upstreamChecksum": null,
      "upstreamVerified": false,
      "derivedFrom": "lexibank/abvdphilippines-v1.0.zip:lexibank-abvdphilippines-10010f6/cldf/lingpy-rcParams.json"
    },
    {
      "path": "parameters.csv",
      "bytes": 6441,
      "sha256": "0f9fe567f81adba5dd580e2d357e3e857d6da043fe8d8e60501bc1f5604ed215",
      "url": "https://zenodo.org/api/records/13304336/files/lexibank/abvdphilippines-v1.0.zip/content",
      "upstreamChecksum": null,
      "upstreamVerified": false,
      "derivedFrom": "lexibank/abvdphilippines-v1.0.zip:lexibank-abvdphilippines-10010f6/cldf/parameters.csv"
    },
    {
      "path": "requirements.txt",
      "bytes": 895,
      "sha256": "134088a04927c6ede2662e5223559592125f8ade57a93a5e015b2e71e6b58304",
      "url": "https://zenodo.org/api/records/13304336/files/lexibank/abvdphilippines-v1.0.zip/content",
      "upstreamChecksum": null,
      "upstreamVerified": false,
      "derivedFrom": "lexibank/abvdphilippines-v1.0.zip:lexibank-abvdphilippines-10010f6/cldf/requirements.txt"
    },
    {
      "path": "sources.bib",
      "bytes": 35752,
      "sha256": "088ffa49e3829d89ba04f8e90e82d8608604132fea1f67ec1fe204f26b8154f9",
      "url": "https://zenodo.org/api/records/13304336/files/lexibank/abvdphilippines-v1.0.zip/content",
      "upstreamChecksum": null,
      "upstreamVerified": false,
      "derivedFrom": "lexibank/abvdphilippines-v1.0.zip:lexibank-abvdphilippines-10010f6/cldf/sources.bib"
    }
  ],
  "verified": true,
  "fetchedBy": "cli/scripts/fetchers/cldf-zenodo.mjs",
  "notes": "Extracted from lexibank/abvdphilippines-v1.0.zip, whose md5 matched Zenodo's published checksum (md5:1f90d0a3fe3be19a3144d400fd37e2cf). The per-file sha256 values below are ours, computed on extraction — their provenance is the verified archive named in `derivedFrom`, not an independent attestation by the publisher.",
  "fetchedAt": "2026-08-02T18:47:26.703Z"
}
